### ISSUE TITLE
是否应调整Bypass链表的优先级？目的是为了解决UDP NAT的端口不一致问题。

### ISSUE THREAD

**Issue by Hacksign** [yichya/luci-app-xray#480]
# 背景 & 问题

最近在新买的设备上搭建IPSec VPN， 发现xray的透明代理会介入UDP包，导致最终回包的源端口与请求包的目的端口不一致，这最终导致防火墙丢弃回包。

# 问题分析

参考下面的tcpdump示例：

```
17:41:07.817589 pppoe-wan In    IP client-ip.32137  > server-ip.500: isakmp: parent_sa ikev2_init[I]
17:41:07.821927 lo  In    IP server-ip.500 > client-ip.32137: isakmp: parent_sa ikev2_init[R]
17:41:07.823584 pppoe-wan Out IP server-ip.50577 > client-ip.32137: UDP, length 38
```

上述包的转发路径：

1. 客户端请求服务端的500号端口服务
2. 透明代理介入，将500的包发送到lo链路（xray介入）
3. 响应包由pppoe-wan发出，但是源端口变成了50577（预期应该是500）

这导致（部分非FULL NAT的）ISP的防火墙会丢弃这种三元组无法匹配的包，进而导致NAT后面的客户端收不到回报。

# 如何解决

1. 最简单的办法，直接禁用xray（或禁用xray的UDP透明带里），但这是治标的办法
2. 本插件提供了bypass udp/tcp port的功能，使用该功能放行特定端口的数据包，让他不要进入到透明带里的处理链路

如果采用方案2，那么目前从我的视角看，是无法达成目标的，从实际测试的结果看，包依然会进入到xray中。分析了一下成因，如下（我手头目前接触不到环境，所以直接用模板文件 `luci-app-xray/core/root/usr/share/xray/firewall_include.ut` 改造一下进行说明）：

```
    chain tp_spec_lan_ac {
        ip daddr @tp_spec_dv4_sp {{ counter }} accept
        ip6 daddr @tp_spec_dv6_sp {{ counter }} accept
         goto tp_spec_lan_re
    }

    chain tp_spec_lan_re {
        udp dport { 500, 4500 } accept

        meta l4proto tcp {{ counter }} goto tp_spec_lan_dd
        meta l4proto udp {{ counter }} goto tp_spec_lan_dd

        {{ counter }} accept
    }
```

在outbound routing，端口默认forward模式，在添加udp的bypass port之后， 生成的防火墙规则文件中的相关内容大概长上面这个样子。

上面的配置，会导致500和4500端口的数据包继续走xray的透明带里。

实际测试后，改成下面的样子可以解决问题，既将 `udp dport { 500, 4500 } accept`移动到规则的更顶端让其优先匹配：

```
    chain tp_spec_lan_ac {
        udp dport { 500, 4500 } accept
        ip daddr @tp_spec_dv4_sp {{ counter }} accept
        ip6 daddr @tp_spec_dv6_sp {{ counter }} accept
         goto tp_spec_lan_re
    }

    chain tp_spec_lan_re {
        meta l4proto tcp {{ counter }} goto tp_spec_lan_dd
        meta l4proto udp {{ counter }} goto tp_spec_lan_dd

        {{ counter }} accept
    }
```

# 最终问题

所以，我的最终问题是， 是否应该考虑outbound routing中bypass tcp/udp端口的规则优先级？

# 其他

此问题关联XTLS论坛[这个](https://github.com/XTLS/Xray-core/discussions/5475)帖子

**Comment by yichya** [comment]
按说你这个改之前和改之后没区别啊，并没有额外的包被滤掉。。。

另外作为临时方案可以顺便试一下 Preview 里面的这个功能，虽然不是用来做这件事的但或许也能用

<img width="833" height="595" alt="Image" src="https://github.com/user-attachments/assets/edb6c6c4-2b38-4703-9a36-47a41f58d42e" />

**Comment by Hacksign** [comment]
抱歉， 实际环境中看了一下， 生效的配置应该是

```
udp sport { 500, 4500 } accept
```
和优先级没有关系。

而当前`luci-app-xray/core/root/usr/share/xray/firewall_include.ut`中只设置了dport， 没有设置sport。

```
    chain tp_spec_lan_re {
{% if (transparent_default_port_policy == "bypassed"): %}
    {% if (length(wan_fw_tcp_ports) > 0): %}
        tcp dport { {{ join(", ", wan_fw_tcp_ports) }} } {{ counter }} meta l4proto tcp goto tp_spec_lan_fw
    {% endif %}
    {% if (length(wan_fw_udp_ports) > 0): %}
        udp dport { {{ join(", ", wan_fw_udp_ports) }} } {{ counter }} meta l4proto udp goto tp_spec_lan_fw
    {% endif %}
{% else %}
    {% if (length(wan_bp_tcp_ports) > 0): %}
        tcp dport { {{ join(", ", wan_bp_tcp_ports) }} } {{ counter }} meta l4proto tcp accept
    {% endif %}
    {% if (length(wan_bp_udp_ports) > 0): %}
        udp dport { {{ join(", ", wan_bp_udp_ports) }} } {{ counter }} meta l4proto udp accept
    {% endif %}
        meta l4proto tcp {{ counter }} goto tp_spec_lan_dd
        meta l4proto udp {{ counter }} goto tp_spec_lan_dd
{% endif %}
        {{ counter }} accept
    }
```

似乎界面上并没有考虑控制是sport还是dport？ 

是否可以参考v2ray的配置风格，以`[sport/dport:]端口` 的格式控制设置是sport还是dport, 比如：
1. sport:1234配置sport
2. dport:1234配置dport
3. 为了兼容当前配置， 直接使用端口号为配置dport

？

**Comment by Hacksign** [comment]
## 设备拓补情况
一台安装了OpenWRT的路由器，上面部署了xray和IPSec VPN， 该路由器通过PPPOE拨号上网，可以获得原生公网IP地址。

## 当前的问题
假设路由器拨号获得的公网ip是1.1.1.1。 此时有一台其他网络的、位于防火墙之后的无公网ip设备192.2.2.2 (其网络出口IP假设为2.2.2.2) 来访问1.1.1.1上的IPSec VPN服务（位于500号端口）。
那么，数据包大概会是这个样子。

```
情况1:
17:41:07.817589 pppoe-wan In    IP 2.2.2.2.32137  > 1.1.1.1.500: isakmp: parent_sa ikev2_init[I]
17:41:07.821927 lo  In    IP 1.1.1.1.500 > 2.2.2.2.32137: isakmp: parent_sa ikev2_init[R]
17:41:07.823584 pppoe-wan Out IP 1.1.1.1.50577 > 2.2.2.2.32137: UDP, length 38
```

也就是说， 192.2.2.2 这台设备试图访问 1.1.1.1 的500号端口， 但是由于192.2.2.2在防火墙后面，所以实际向1.1.1.1发起请求的（在服务端来看）是2.2.2.2的32137号端口。

正常来说，1.1.1.1应该通过源端口500直接响应2.2.2.2的32137号端口，既预期的正常包应该是下面这个样子

```
情况2:
17:41:07.817589 pppoe-wan In     IP 2.2.2.2.32137  > 1.1.1.1.500: isakmp: parent_sa ikev2_init[I]
17:41:07.821927 pppoe-wan Out    IP 1.1.1.1.500 > 2.2.2.2.32137: isakmp: parent_sa ikev2_init[R]
```

但是目前的链路上，多了一个透明代理的转发，既：

```
17:41:07.821927 lo  In    IP 1.1.1.1.500 > 2.2.2.2.32137: isakmp: parent_sa ikev2_init[R]
```

最终导致内核重新路由后，包是通过源端口`50577`回复回去的：

```
17:41:07.823584 pppoe-wan Out IP 1.1.1.1.50577 > 2.2.2.2.32137: UDP, length 38
```

既，在客户端的防火墙看来， 我（2.2.2.2）通过源端口32137向目的ip（1.1.1.1）的500端口发送了一个请求， 那么**有一些防火墙会期望直接从1.1.1.1:500收到回复的包**，这样防火墙才能正确处理NAT，将该回复包转发给后面的192.2.2.2。

但是目前的情况是， 实际的回复包是通过1.1.1.1:`50577`这个端口回复的, 防火墙没有这条NAT规则， 所以他不会将此条回复转发给后面的192.2.2.2, 既最终客户端无法收到回包。

我不是非常了解透明代理的内核路由过程，但是目前通过测试情况来看，如果不加sport accpet这条规则， 那么从实际抓包情况来看，路由就会是`情况1`, 如果加上sport的规则，那路由就会是`情况2`, 只有`情况2`才能正常工作。

UDP是无连接的， 所以理论上用什么源端口进行回复不存在问题，**但是实践上有很多ISP的防火墙会看N元组来决定NAT到哪台内网机器**。目前我这边测试就是因为请求的目的端口不是回复的源端口，导致匹配N元组失败，包被丢弃。

## IPv6的情况

我手头没有IPv6的测试条件，因此无法进行测试。

但是根据TCP/IP的传输机制， 理论上应该和IPv4没有区别。

**Comment by yichya** [comment]
懂了。刚好，能不能顺便确认下其他协议会不会有类似问题，主要是 h2 和 h3，我这边考虑一下怎么处理这个
